,company,idandtype,review_counts,reviewid,date,total_rating,interest_sat,online_sat,prof_sat,service_sat,review
70,shinhan,20RENT,38,8993,2016. 04. 30.,5.0,5,5,5,5," 안녕하세요. 전세를 알아보는중에 마음에드는집을 발견하였지만 자금부족으로 1억2천만원 대출이 필요하였습니다. 주거래은행인 우리은행을 비롯하여 신한/국민/농협에서 대출상담을 하였습니다. 

 처음에는 주거래인 우리에서 진행하고자 했으나 매우 복잡한 절차와 고압적인 태도로 일관되었습니다. 또한 한도를 다 못받을 수 있다며 비아냥을 듣고서 타은행을 알아보게 되었습니다.

 결론부터 말씀드리면 저는 신한은행을 선택하였습니다. 제가 알아본 최저금리는 주거래우대 변경조건으로 신한2.55/우리2.82/농협2.65/국민2.9였습니다. 신한에서만 유일하게 원금동시상환상품을 소개받았으며 0.2프로 우대금리를 받아 가장저렴하였습니다. 필요서류또한 재직증명/원천소득증명/주민등초본/부동산계약서로 우리은행대비 간소하였습니다.

 원금분할상환 금액은 자유롭게 정할 수 있기에 조금 여유가 있으시다면 수십만원씩 원금도 동시상환하시면서 대출이자도 줄여나갈 수 있습니다. 또한 원리금 상환액이 750까지 그 40%인 최대 300만원 소득공제 해택이 있기에 어떤 절세 방법보다 유리합니다.

 제 경험이 전세를 알아보는 분에게 도움이 되셨으면 좋겠습니다. 긴글 읽어 주셔서 감사합니다."
71,shinhan,20RENT,38,8994,2016. 04. 13.,3.75,4,4,4,3,"타은행보다 이율이 조금 낮은 편이다. 국민은행 아니면 신한은행이 고려된다. 하지만, 온라인상 상세한 설명이 부족하다. 은행 창구에 가야만 상담이 가능하다."
72,shinhan,20RENT,38,8995,2016. 04. 13.,3.25,3,3,3,4,"전세대출을 받았는데 큰 은행이라 신뢰가 높아서 좋아여 하지만, 단점은... 딱히 모르겠네요. 아 상품설명(중도반환 가능여부)잘못 알려주셨네요"
73,shinhan,20RENT,38,8996,2016. 04. 13.,3.5,3,3,4,4,"전세자금 대출을 받는데 대출상담해주셨던 분이 친절해서 너무 좋았다 하지만, 좀더 많은 대출에 관련된 부분을 쉽게 알려주셨으면 좋겠다"
74,shinhan,20RENT,38,8997,2016. 04. 13.,3.25,4,3,3,3,"전세대출을 받았는데 한도를 최고로 해줘서 부담이 적었다 하지만, 이율이 생각보다 높다"
75,shinhan,20RENT,38,8998,2016. 04. 13.,4.5,4,5,4,5,"궁금증을 해소해 줘서 좋음. 다른 상품과의 비교가 좋음 하지만, 창구에 가야지 만족할만한 답변을 들을 수 있다는 번거로움"
76,shinhan,20RENT,38,8999,2016. 04. 13.,3.0,3,3,3,3,"전세대출을 받았는데 다른 은행보다 낮은 이자율 하지만, 별로없음"
77,shinhan,20RENT,38,9000,2016. 04. 13.,4.25,4,4,4,5,"2년마다 전화로 갱신 해줘서 편하다 , 단점은 대출 갱신할때마다 수수료를 내야 한다"
78,shinhan,20RENT,38,9001,2016. 04. 13.,4.25,4,4,5,4,"대출 상담받으러 갔을 때 친절하게 대해줘서 편했다, 단점은 서비스는 좋으나, 금리가 높아서 상품에 대해서는 불만이 있다"
79,shinhan,20RENT,38,9002,2016. 04. 13.,2.75,3,2,3,3,"대출 상담을 최대한 간략하게 쉽게 진행해줘서 상담이 오래걸리지 않음, 단점은 중도상환에 따른 최적화된 금리 및 이자의 안내가 없어, 소비자가 알아서 계산해야 함"
80,shinhan,20RENT,38,9003,2016. 04. 13.,2.5,3,1,3,3,"어플리케이션으로 대출금을 납부하기 편리하다., 단점은 이자가 타은행보다 높게 책정되어 있고 대출심사가 까다롭다."
81,shinhan,20RENT,38,9004,2016. 04. 13.,3.25,3,2,4,4,"대출상담을 친절하게 해주시고 미리 전화도 주셔서 좋앗음, 단점은 상품이 좀 다양했으면 좋겟음"
82,shinhan,20RENT,38,9005,2016. 04. 13.,5.0,5,5,5,5,"추가 금리할인 장애인 할인등 꼼꼼히 안내해 주셨음 직원분 응대가 너무 마음에 듬, 단점은 단점은 대출을 따로 많이 이용해보지 않아 나뿐점인 잘 모르겠음 "
83,shinhan,20RENT,38,9006,2016. 04. 13.,3.5,4,3,3,4,"이자가 낮고 기존 고객이라 이것저것 금리우대를 많이 받을 수 있었음, 단점은 대출에 가입하기 위해 작성해야 하는 서류가 너무 많고 절차가 복잡함"
84,shinhan,20RENT,38,9007,2016. 04. 13.,3.75,4,4,4,3,"신한은행이 그래도 타은행보다 대출 금리가 조금 낮은 편이다, 단점은 온라인상 상세한 설명이 부족하다. 은행 창구에 가야만 상담이 가능하다"
85,shinhan,20RENT,38,9008,2016. 04. 13.,4.0,4,4,4,4,"친절한 상담과 대응이 마음에 들었다, 단점은 큰 단점이 없다"
86,shinhan,20RENT,38,9009,2016. 04. 13.,2.75,2,3,3,3,"없다.신혼부부전세자금 대출이용중인데 추가대출당시 타은행보다 이자이율이 높았던걸로안다, 단점은 전화상담 한번받으려면 하루종일 전화붙들고있거나 상담받는 상담원마다 대답이 다 틀리다"
87,shinhan,20RENT,38,9010,2016. 04. 13.,3.25,3,4,3,3,"우대금리가 많다., 단점은 타은행에 비해 금리가 높다."
88,shinhan,20RENT,38,9011,2016. 04. 13.,4.0,4,4,4,4,"전세대출 중에 금리가 낮고 담당 직원이 일처리가 정확하고 빨라서 만족했다, 단점은 전세대출 서류 중에 일부 반환 처리가 안되어, 까먹고 있다가 따로 연락해서 받았던 약간의 실수가 있었다"
89,shinhan,20RENT,38,9012,2016. 04. 13.,3.25,2,3,4,4,"전세대출 상품이 잘 되어있다, 단점은 금리가 높다"
90,shinhan,20RENT,38,9013,2016. 04. 13.,3.75,4,4,3,4,"대출할때 상담도 친절하고 주거래 은행이라 전세 대출 가입이 용이한 편이었다., 단점은 잘 모르겠음.. 불편한점이 별로없다"
91,shinhan,20RENT,38,9014,2016. 04. 13.,4.5,4,4,5,5,결혼에 맞춰 신혼집을 구하던중 전세가 있어 신한은행에서 대출을 알아봄 담당자의상세하고 친절한 설명으로 은행 대출이 전세금의 80프로 까지 된다는 사실을 알게 됨 물론 주인의 동의하에 가능 그렇게 하여 대출을 하는 과정에서 서류가 은근히 많다는 느낌이 많이듬 사인해야할 것두 많음 어쨌든 편리하고 무사히 대출 완료
92,shinhan,20RENT,38,9015,2016. 04. 13.,3.25,4,3,3,3,"갑자기 이사를 가야해서 집을 알이보던중 부동산에서 이사갈 집을 정하고 바로 부동산 사무실로 은행직원이 와서 전세대출을 해줬다.

은행은 우리가 선택했지만 대출상품은 추천해주는걸로 했음.

하지만 우대금리를 받으려면 월급통장을 바꿔야하는 조건이있었음"
93,shinhan,20RENT,38,9016,2016. 04. 13.,4.0,4,4,4,4,"전세금이 올라 신한은행에서 전세대출을 받게 됐습니다. 대출진행과정은 편했습니다. 금리는 예상보다 다소 높았네요. 우대금리를 받기 위해 펀드 2개, 예금 1개를 가입해야 하는게 아쉬웠습니다."
94,shinhan,20RENT,38,9017,2016. 04. 13.,3.5,3,1,5,5,"증빙서류가 많고 담당하는 부서가 다 달라서

서류제출을 위한 이동이 잦았음"
95,shinhan,20RENT,38,9018,2016. 04. 13.,3.5,3,2,4,5,결혼을하면서 신혼집을 얻기위해 신혼전제대출을 7천8백만원받았습니다. 결혼5년차가되면서 살림도많아지고 모아둔 돈은없고해서 이사를 해야하는데 전세금이 부족하던차에 공인중개사 소개로 영업점 상담사를 소개받고 멀리 방문하지 않고 공인중개사무실로 서류를 가지고와서 편하게 대출절차를 밟았습니다. 또한 기존대출금리보다 할인을해서 좋았습니다.
96,shinhan,20RENT,38,9019,2016. 04. 13.,5.0,5,5,5,5,집주인이 전세금을 갑자기올리는바람에 회사주거래은행에가서 대출을받음
97,shinhan,20RENT,38,9020,2016. 04. 13.,2.75,2,3,3,3,전세대출이 필요해서 신한은행에 갔는데 이율이 5%가 넘어가서 너무 비싸다는 느낌이 들었다. 딱히 선택권이 없어서 어쩔수없이 하긴 했는데 좀 다양한 상품이 있었으면 좋겠다
98,shinhan,20RENT,38,9021,2016. 04. 13.,4.75,5,5,4,5,"주택전세자금 대출을 받아야해서 주거래은행인 신한은행을 찾았다. 대출의 경험이 없기에 여러가지 의문도 많고 알아야하는 것들이 많이 있었다. 직원의 설명이 어렵지않게 이해되었다. 금리도 3%대의 낮은 금리였고, 내 상황에 적절한 상품을 소개해주어서 다른 은행을 찾아볼 필요없이 대출할수 있었다. 상황적 어려움으로 대충받기가 까다로울수 있었으나 이런 상황에서 어떻게 대처해야하는지 친절한 상담을 해주었고 대출후에 해야하는 일들에 대한 설명도 좋았다. 어쩔수 없는 거긴하지만 상담하는 직원에 따라 전문성의 차이가 있었기에 그 부분은 조금 아쉬웠던 것 같다. 혹시 전세대출이 필요하다면 방문후 상담을 받아보는것도 좋을 듯 하다."
99,shinhan,20RENT,38,9022,2016. 04. 13.,3.75,4,3,4,4,전세금이부족하여 대출알아보던중 부동산소개로방문대출가능하다기에 상담받았다. 나의시간에 맞춰 가까운곳에서 상담받아서 편리했고 비교적 간단한 추가 상품 가입으로 우대금리를 적용받아서 좋았습니다
100,shinhan,20RENT,38,9023,2016. 04. 13.,3.25,4,2,3,4,"주거래은행아라서 신한은행을 택했고 4년전에 같은 신한은행 다른지점에서 전세대출을 했었는데 갑자기 하는거라 좀 힘든상황에서도 담당직원분이 매우 친정하고 자기일처럼 도와주셔서 참 좋았습니다

2년 후 다시 이사를 가서 같은 전세대출을 받았는데 전과 다른 지점에서 했는데 전처럼 친절하진 않았고 꼭 해줘야할말만 형식적으로 하는느낌.. 그래도 우대받기위해 할수있는부분 알려주셔서좋았는데 상품권유를 자꾸 해서 불편했습니다 "
101,shinhan,20RENT,38,9024,2016. 04. 13.,4.25,4,3,5,5,"서울 전세집값이 폭등을 하게 되어 결헌을 준비하면서 대출을 받게 되었습니다

우선 어떠한 대출을 받기전에

지인들의 추천은행이나 선호하는 은행등을 몇가지 선정해서 비교해보는게 좋을 것 같습니다

본인에게 맞는 상품을 전화문의나 검색을 하여 찾고 그상품에대한 대출준비서류와같은 필요서류를 사전에 준비하면 다시방문해야 하는 불편함을 줄일 수 있었습니다

이런 준비가 끝나셨다면

선정하신 몇개의 은행에 방문하여

동일한 조간으로 대출금리를 비교해 보신다면 자신한테 제일 유리한 금리를 찾으실 수 있습니다.

또 방문시 상담후에 필요서류 리스트를 문서로 작성해달라고 상담해주신 은행직원에게 요청을 하면 친절하게 본인에 맞는 상담내용을 작성하여 주시더라고요

참고하셨으면 좋겠습니다"
102,shinhan,20RENT,38,9025,2016. 04. 13.,4.25,5,2,5,5,"원래 전월세로 살다가 잘 알아보면 월세보다 대출 상환금이 더 작을 수도 있다고 하여 인터넷 검색을 하였고, 서민근로자전세자금대출이라는 것을 알게 되었습니다.

이 대출은 국민주택기금이 주관하여 수탁받은 은행에서만 가능한데, 그렇다보니 국민주택규모를 넘지 않는 선에서 대출한도는 전세금의 70%였고 금리도 비교적 낮았습니다. 물론 제시하는 요건에 부합해야 대출이 가능한데, 저의 경우는 처음 이 대출상담을 위해 모 은행을 방문하였고 그 곳에서는 안된다고 했었습니다. 안된다고 한 근거가 모호하여 주거래은행인 신한은행으로 가서 상담을 받았는데 안될 이유가 없다며 대출절차를 밟게 되었고 지금은 적은 대출금리로 이자상환중입니다. 변동금리라고 했으나 그 폭이 크지 않아서 지금까지는 체감을 못하고 있구요. 서류가 많아서 작성하는데 많은 시간이 걸린다는 단점이 있지만, 전세세입자로서 매우 만족하는 중입니다."
103,shinhan,20RENT,38,9026,2016. 04. 13.,2.75,3,2,3,3,주거래은행은 아니었지만 금리우대 혜택을 적용해주어서 이자부담이 조금 줄었어요 이자출금일자에 문자발송이되어서 이자가 연체되지않도록 관리하기 쉬워요
104,shinhan,20RENT,38,9027,2016. 04. 13.,4.0,4,4,4,4,"주택전세자금이 필요하던차에 부동산을

통해 대출상담사를 소개받고 대출을

의뢰하게 되었습니다. 금리가 낮고 친절한

설명으로 기분좋게 가입하게 되었습니다."
105,shinhan,20RENT,38,9028,2016. 04. 13.,1.75,1,1,2,3,"주거래 은행임에도 불구하고 특별한 메리트가 전혀 없었으며, 전세대출시 신한은행을 추천하지 않을 생각임"
106,shinhan,20RENT,38,9029,2016. 04. 13.,3.0,4,2,3,3,주거래 은행에서 거래 하며 이자 낮추기 위한 방법을 물어서 가능한 다 하면 좀 더 낮은 금리로 받을 수 있습니다
107,shinhan,20RENT,38,9030,2016. 04. 13.,2.75,3,2,3,3,갑작스럽게 이사를 가야 되는 상황이어서 급하게 집을 알아보던 중 괜찮은 전세를 알게 되었습니다. 그러나 이것에 들어가기 위해서는 추가적인 자금이 필요했습니다. 그래서 전세 자금을 주거래 은행인 신한은행에서 받기로 했고 비교적 빠른시일에 돈을 받을 수 있었습니다. 그러나 제출할 서류둘이 너무 많아 힘들었습니다. 또 제출한 서류들에 대한 심사도 까다로운 편이었습니다 직접 전세 받을 집에 가서 심사도하고 집주인과 통화도 하였습니다. 그래도 전세 대출을통해 거주하는 것이 월세보다 저렴하기 때문에 만족하고 있습니다
108,suhyup,193RENT,1,11133,2016. 04. 13.,3.25,4,3,3,3,"대출상담 받을 때 은행 직원이 친절하게 자세하게 해줘서 좋아요 , 단점은 지점 수가 많지 않아 방문하기가 쉽지 않다"
109,woori,98RENT,69,10944,2016. 07. 29.,4.0,4,4,4,4,대출에 대해서 많이는 모르지만 전문상담사와 1:1로 상담을해 본적이 없어 한번 상담과 함께 궁금증을 풀 수 있을 거 같아 좋네요^^ 
110,woori,98RENT,69,10945,2016. 07. 28.,3.5,3,4,3,4,"1억 이상의 대출이 있었는데 은행과 정부기관의 적절한 비율로 추천해주어 좋은 집으로 이사가게 되었습니다.
변동금리는 꾸준히 모니터링하여 고정금리도 변동금리로 갈아탈 예정입니다."
111,woori,98RENT,69,10946,2016. 04. 13.,3.0,3,3,3,3,"전세대출을 받았는데 대출상담을 친절히 해주어 고마웠음 하지만, 대출 금리가 높고 낮추기 위해 같은 은행에 여러 상품이용 권유를 받음"
112,woori,98RENT,69,10947,2016. 04. 13.,3.0,3,3,3,3,"전세자금대출을 받았는데 대출 상품이 여러개 있어서 좋다.  하지만, 여러가지를 물어보면 건성으로 빨리빨리 응대한다. "
113,woori,98RENT,69,10948,2016. 04. 13.,2.0,2,2,2,2,"전세자금대출을 받았는데 은행 창구가 많다 하지만, 서류가 여러장이 필요함"
114,woori,98RENT,69,10949,2016. 04. 13.,3.75,3,4,4,4,"대출상담을 친절히 잘 설명해 주었음 하지만, 설명의 전문성이 떨어진다"
115,woori,98RENT,69,10950,2016. 04. 13.,3.75,4,4,4,3,전세대출을 받았는데 고객의 입장에서 유리한 사항을 알려줌
116,woori,98RENT,69,10951,2016. 04. 13.,3.0,3,3,3,3,"전세대출을 받았는데 직원이 매우 친절했음, 단점은 고정금리라서 금리가 높은 편임"
117,woori,98RENT,69,10952,2016. 04. 13.,3.75,4,4,3,4,"대출에 대해 잘 몰랐으나 알기 쉽게 진행해줌, 단점은 예금등 가입할때는 본인 아니어도 가입해주고 해지하는건 꼭 본인이 해야된다함"
118,woori,98RENT,69,10953,2016. 04. 13.,4.25,3,5,4,5,"우리은행 전세대출은 타 은행 전세대출에 비해 더 우대해주려는 의도가 보였음, 단점은 장애인 이나 우대 조건에 대한 저세한 확인 필요"
119,woori,98RENT,69,10954,2016. 04. 13.,4.0,4,4,4,4,"대출 시 금리가 낮은 상품을 적극적으로 확인해주는 노력과 함께 다자녀 및 가구 구성원 (장애인)에대해 확인하고 이자 감면에 많은 도움을 주었어요, 단점은 홈페이지에서 할 수 있는 대출연장이 오류가 많고 내방해야 하는 경우가 많아 불편했어요"
120,woori,98RENT,69,10955,2016. 04. 13.,3.75,4,3,4,4,"대출 받으러 지점 방문시 비교적 친절하게 대해줬다, 단점은 여러가지 상품에 대해 설명해주지 않고 1-2개만 설명해줬다"
121,woori,98RENT,69,10956,2016. 04. 13.,3.75,2,3,5,5,"모르는 부분들을 친절하게 알려줘서 편리하고 이해하기 쉬웠음, 단점은 신혼부부 대상 저금리형 대출이라고 하는데 생각보다 금리가 높았음"
122,woori,98RENT,69,10957,2016. 04. 13.,4.0,4,4,4,4,"대출 상담이 친절해서 마음 편히 상담 받을 수 있었다, 단점은 금리우대를 해주긴 했으나 다른데와 다 비슷해서 크게 차별적인 메리트가 존재하지 않는다"
123,woori,98RENT,69,10958,2016. 04. 13.,3.0,3,3,3,3,"상담을 친절하게 잘 해주며 대출 금리를 유리하게 받을 수 있게 잘해줌, 단점은 여러가지 금리우대사항이 있어 대출금리를 더 낮출 수 있을 것 같이 보이지만, 실질적으로 우대를 받기가 어려움"
124,woori,98RENT,69,10959,2016. 04. 13.,3.5,2,4,4,4,"구비서류와 모든것을 친절하게 알려주심, 단점은 이미 승인된 대출임에도 불구하고 새로 연장할때마다 작성해야 하는 서류가 많음"
125,woori,98RENT,69,10960,2016. 04. 13.,4.25,4,4,5,4,"대출상담 쉽고 편의를 잘봐줌  서류같은게 조금 늦더라도 이래저래 방법 가르쳐주고 도와준다, 단점은 대출받으면서 은근슬쩍 카드가입도 시킨다  정신없어서 그냥 카드만들었지만  쓰지도 않고 수수료만 낸격"
126,woori,98RENT,69,10961,2016. 04. 13.,3.5,3,3,4,4,"지점 방문시 대출 상담을 자세하고 친절하게 잘 해주었다, 단점은 전화응대가 불만족스러웠다 (대출관련해서 필요한 서류를 물어보았는데 말도 번복하고 친절하지도 않음)"
127,woori,98RENT,69,10962,2016. 04. 13.,4.5,5,5,3,5,"전세자금대출은 우리은행이 가장 이율이 낮아서 좋다, 단점은 대출금리는 낮으나 늘 고객이많아서 오래기다려야하고 상담이어렵다"
128,woori,98RENT,69,10963,2016. 04. 13.,3.5,2,4,4,4,"직원들이 설명해줄 때 전문적이라는 느낌을 받았고 친절하게 대해줌, 단점은 나의 상황에 맞게 대출 받는 것이 불가능하다는 느낌 받음"
129,woori,98RENT,69,10964,2016. 04. 13.,3.25,4,3,3,3,"친절한 응대와 상세설명이 좋았음, 단점은 대출받은지점에서만 구체적 상담이 가능하여 불편함 전지점 상세설명이 있었으면 좋겠음"
130,woori,98RENT,69,10965,2016. 04. 13.,3.0,3,3,3,3,"대출상담을 친절히 해주어 고마웠음, 단점은 대출 금리가 높고,낮추기 위해 같은 은행에 여러 상품이용 권유를 받음"
131,woori,98RENT,69,10966,2016. 04. 13.,4.0,4,4,4,4,"당시 최고로 낮은 금리로 대출을 받을 수 있도록 잘 가이드 해주었다., 단점은 상환기간 선택의 폭이 좀 더 다양했으면 좋겠다."
132,woori,98RENT,69,10967,2016. 04. 13.,3.25,3,3,3,4,"친절한 응대가 좋음, 단점은 애용자가 많아 대기시간이 길다"
133,woori,98RENT,69,10968,2016. 04. 13.,4.0,4,4,4,4,"상품도 다양하고 친절하다, 단점은 특별히 없다"
134,woori,98RENT,69,10969,2016. 04. 13.,4.0,4,4,4,4,"친절히 응대해줘서 불편함이 없었다, 단점은 새로운 상품이 많지 않은것 같다"
135,woori,98RENT,69,10970,2016. 04. 13.,3.75,4,3,4,4,"저금리로 대출 받을 수 있도록 도와줌, 단점은 직원에따른 설명 및 응대 편차가 심함"
136,woori,98RENT,69,10971,2016. 04. 13.,3.25,4,2,3,4,"대출시 설명이 이해하기 편했다, 단점은 단점은 잘모르겠음"
137,woori,98RENT,69,10972,2016. 04. 13.,3.5,4,3,3,4,"직원은 아닌 것 같고, 부동산에서 소개해준 중개인이 친절하게 안내해 주었다., 단점은 전세대출을 부동산 연계로 중개인에게 진행되어, 나에게 은행이나 상품을 선택할 권한이 없었다."
138,woori,98RENT,69,10973,2016. 04. 13.,3.25,3,3,3,4,"친절해서 좋음. 다만 아파트 가격이 비싸 원하는만큼 못받았음, 단점은 타은행대비 뛰어난 단점은 딱히 없음"
139,woori,98RENT,69,10974,2016. 04. 13.,2.0,3,2,1,2,전세와 월세를 고민하다가 전세 대출을 받기로 마음먹고 이것저것 인터넷을 찾고 직접 방문한 후에 결정하게 되었습니다 하지만 전제적으로 불친절하고 원하는 자료가 너무 많고 힘들었습니다. 그나마 집에서 가장 가까워 선택했습니다. 왔다갔다 하기 편한 쪽을 택했지만 결국 불만족입니다. 제가 원하는 대로 이뤄지지 않았기 때문입니다. 
140,woori,98RENT,69,10975,2016. 04. 13.,2.25,3,1,1,4,"이사를 고민하던 중에 금리도 낮아지고 해서 분당에 아파트를 구입하기로 하고 대출을 받았습니다. 받은 시점은 2015년 월이고요. 국민, 시티, 우리 세 군데를 갔었는데 시티가 주거래 은행은 아니지만 우대금리 요건도 다자녀가구 같이 단순해서 선택했어요. 직원도 친절하고 상품권유도 적은 편이었고요. 근데 최저금리를 받느라 변동금리로 받았는데 만기가 30년이라 지금은 좀 걱정이 되기도 합니다. 그런 부분에 대한 설명을 미리 안 해준 것은 좀 아쉬운데... 어떤 금리로 받을지, 중도상환 조건은 어떻게 되는지 이런 걸 미리 공부해두시면 좋을 것 같아요. 6개월 변동 금리라 6개월마다 금리가 어떻게 바뀐다고 알려주긴 하는데 더 좋은 대출상품이 나왔다던가 우대금리를 유지하려면 이런 거 신경써라 이런 걸 알려주면 좋을 것 같"
141,woori,98RENT,69,10976,2016. 04. 13.,4.75,4,5,5,5,아는 직원을 통해 가입해서 많이 생각해보지 않고 가입했다
142,woori,98RENT,69,10977,2016. 04. 13.,4.5,4,4,5,5,주거래은행이라 이용했다 그닥좋은점도 나쁜점도 없었다 직원들이 친절해서 좋았을뿐
143,woori,98RENT,69,10978,2016. 04. 13.,4.0,4,2,5,5,작년 12월 이사로 인해 비용부족으로 전세대출을 받았습니다. 우리은행이 주거래은행이었고 다른 서민대출은 자격이 안돼 결국 은행 상품을 이용하게 되었습니다. 직원분은 친절했고 응대도 잘 해주셨습니다. 부족한 서류들로 몇번 왔다갔다했고 사인해야하는 문서가 많은게 불편했지만 대출절차는 어딜가나 똑같다고 봅니다. 카드와 계좌등 상품이용으로 우대금리 잘 받아서 다행이라고 생각됩니다. 전체적으로 서비스나 절차는 만족스러운 편이고 대출에 필요한 서류나 자격요건등 정보가 좀 다 자세히 정리되어 대출이 필요한 사람들에게 잘 전달되었으면 합니다
144,woori,98RENT,69,10979,2016. 04. 13.,4.25,4,4,4,5,"지난해 결혼을 하면서 전새자금이 팔요해 대출을 알아보게 되었습니다. 

여러은행들에서 상담을 받았으나 주거래은행에서도 큰 혜택을 받을수는 없던중 상담직원이 인터넷상품을 추천해주었습니다. 

확실히 금리적인 측면에서 장점이 있었습니다. 서류 준비중 궁금점도 ARS를 통해 해결할 수 있어 만독스러웠습니다. "
145,woori,98RENT,69,10980,2016. 04. 13.,3.5,2,2,5,5,"전세대출을 위해 주거래은행에 문의 자세한설명과 우대금리 적용 등 안내를 잘 받았습니다 신혼부부 대출 등 좀더 이율이 싼 정부지원 대출 자격요건등도 꼼꼼히 체크해주셔서 다른 은행 대출조건등은 비교하지 않았습니다 

다만 대출을위한 서류 등 절차 및 프로세스가 너무 복잡해 몇차례방문 및 문의 그리고 서류 발급을 위한 시간낭비가 많았습니다 "
146,woori,98RENT,69,10981,2016. 04. 13.,4.0,4,3,4,5,"투룸 전세로 들어가게되어, 회사내에 있는 새마을금고와 우리은행을 방문했고 우리은행의 금리 및 대출조건이 좋아서 선택했습니다. 요청하는 서류를 준비 후 대출진행하였고 한번에 절차를 밟을 수 있어서 편리했습니다. 걱정스러운 부분은 2년 계약완료 이후 다른 곳으로 이사할 시 다시 전세대출을 받아야하는 번거로움이 있을거란 것에 또 신경써야할 부분이 생길 것 같아 걱정입니다. 또한 원리금 상환이 안되고 이자만 나가는 방식이라 가계 계획에 신경이 많이 쓰이며, 원금상환 한도가 있고, 그 이상 갚을시 수수료가 발생한다는 점이 아쉽습니다"
